<?xml version="1.0" encoding="UTF-8"?>
<!DOCTYPE days SYSTEM "Schedule.dtd">

<!--
    Document   : dayOfWeek.xml
    Created on : March 07, 2016, 9:00 PM
    Author     : Kelly Liu
-->
<days>
    <day num="4">
        <booking>
		<period time="930"></period>
        <course course_num="4910"></course>
        <room>SW5-1850</room>	
        <instructor>Richard Chau</instructor>
		</booking>
		<booking>
        <period time="1030"></period>
        <course course_num="4910"></course>
        <room>SE12-306</room>
        <instructor>Richard Chau</instructor>
		</booking>
		<booking>
        <period time="1130"></period>
        <course course_num="4910"></course>
        <room>SE12-306</room>
        <instructor>Richard Chau</instructor>
		</booking>
		<booking>
        <period time="1330"></period>
        <course course_num="4850"></course>
        <room>SE12-308</room>
        <instructor>James Parry</instructor>
        </booking>
		<booking>
        <period time="1430"></period>
        <course course_num="4850"></course>
        <room>SE12-308</room>
        <instructor>James Parry</instructor>
		</booking>
    </day>
</days>

