<?xml version="1.0" encoding="UTF-8"?>
<!DOCTYPE courses SYSTEM "Schedule.dtd">

<courses>
    <course course_num="4650">
    <booking>
		<day num="1">Monday</days>
		<period time="1030"></period>
		<room>SE12 306</room>
		<instructor>Medhat Elmasry</instructor>
	</booking>
	<booking>
		<day num="1">Monday</days>
		<period time="1130"></period>
		<room>SE12 306</room>
		<instructor>Medhat Elmasry</instructor>
	</booking>
	<booking>
		<day num="1">Monday</days>
		<period time="1630"></period>
		<room>SE6 205</room>
		<instructor>Medhat Elmasry</instructor>
	</booking>
    </course>
</courses>

