<?xml version="1.0" encoding="UTF-8"?>
<!DOCTYPE periods SYSTEM "Schedule.dtd">

<periods>
    <period time="1130">
		<booking>
        <course course_nunm="4650"></course>
        <day num="1"></dayOfWeek>
        <room>SE12-306</room>
        <instructor>Dargahi, Farnaz</instructor>
        </booking>
		<booking>
	<course course_num="4910"></course>
        <day num="4"></dayOfWeek>
        <room>SE12-306</room>
        <instructor>Richard Chau</instructor>
        </booking>
		<booking>
        <course course_num="4770"></course>       
        <day num="5"></dayOfWeek>
        <room>SE12-306</room>
        <instructor>Trevor Lord</instructor>
        </booking>
    </period>
</periods>
